{
  "$schema": "./schemas/native-grammar-inventory.schema.json",
  "schemaVersion": 1,
  "baseline": {
    "browser": "chromium",
    "userAgent": "Mozilla/5.0 (X11; Linux x86_64) AppleWebKit/537.36 (KHTML, like Gecko) HeadlessChrome/151.0.7922.34 Safari/537.36",
    "propertyManifestSha256": "6622a8e9731e13437f56221fac0def5e5c0fe75ceb190e7b5194ffb1e64983c1",
    "shorthandCapabilitiesSha256": "9effd1fbe4220206d95b664a58906759d0ee62d420ec6ff85244939b9dc79a33",
    "shorthandGrammarContractsSha256": "ab5d75e051e1b1adb9eaf75be0eb33d109ee75fcde89cef99e50176e6b25c3d3",
    "derivation": "manifest-profile-property-branches@1",
    "valueCapabilitiesSha256": "2a7cd71a24b7296daa6be7c026c5d9494aa2cea72a5c93c68018ea2f858dc998"
  },
  "profiles": [
    {
      "codec": "animation",
      "properties": [
        "-webkit-animation",
        "animation"
      ],
      "contractCaseIds": [
        "grammar.animation.single",
        "grammar.animation.multiple",
        "grammar.animation.direction-fill",
        "grammar.animation.duplicate-duration-invalid"
      ]
    },
    {
      "codec": "background",
      "properties": [
        "background"
      ],
      "contractCaseIds": [
        "grammar.background.color",
        "grammar.background.image",
        "grammar.background.layer",
        "grammar.background.border-area-clip",
        "grammar.background.text-clip",
        "grammar.background.compound-clip",
        "grammar.background.origin-compound-clip",
        "grammar.background.color-before-comma-invalid",
        "grammar.background.duplicate-clip-invalid"
      ]
    },
    {
      "codec": "border",
      "properties": [
        "-webkit-border-after",
        "-webkit-border-before",
        "-webkit-border-end",
        "-webkit-border-start",
        "-webkit-column-rule",
        "border",
        "border-block",
        "border-block-end",
        "border-block-start",
        "border-bottom",
        "border-inline",
        "border-inline-end",
        "border-inline-start",
        "border-left",
        "border-right",
        "border-top",
        "column-rule",
        "row-rule",
        "rule"
      ],
      "contractCaseIds": [
        "grammar.border.width",
        "grammar.border.style-color",
        "grammar.border.all-components",
        "grammar.border.duplicate-style-invalid"
      ]
    },
    {
      "codec": "border-image",
      "properties": [
        "-webkit-mask-box-image",
        "border-image"
      ],
      "contractCaseIds": [
        "grammar.border-image.none",
        "grammar.border-image.slice",
        "grammar.border-image.fill",
        "grammar.border-image.full",
        "grammar.border-image.extra-slash-invalid",
        "grammar.border-image.duplicate-fill-invalid"
      ]
    },
    {
      "codec": "border-radius",
      "properties": [
        "-webkit-border-radius",
        "border-radius"
      ],
      "contractCaseIds": [
        "grammar.border-radius.one",
        "grammar.border-radius.four",
        "grammar.border-radius.elliptical",
        "grammar.border-radius.extra-slash-invalid"
      ]
    },
    {
      "codec": "columns",
      "properties": [
        "columns"
      ],
      "contractCaseIds": [
        "grammar.columns.width",
        "grammar.columns.count",
        "grammar.columns.both",
        "grammar.columns.height",
        "grammar.columns.auto-height",
        "grammar.columns.calculated-height",
        "grammar.columns.zero-height",
        "grammar.columns.two-widths-invalid",
        "grammar.columns.percentage-height-invalid",
        "grammar.columns.negative-height-invalid",
        "grammar.columns.multiple-heights-invalid",
        "grammar.columns.second-slash-invalid"
      ]
    },
    {
      "codec": "container",
      "properties": [
        "container"
      ],
      "contractCaseIds": [
        "grammar.container.name",
        "grammar.container.slash-type",
        "grammar.container.normal",
        "grammar.container.extra-slash-invalid"
      ]
    },
    {
      "codec": "flex",
      "properties": [
        "-webkit-flex",
        "flex"
      ],
      "contractCaseIds": [
        "grammar.flex.grow",
        "grammar.flex.basis",
        "grammar.flex.full",
        "grammar.flex.extra-invalid"
      ]
    },
    {
      "codec": "flex-flow",
      "properties": [
        "-webkit-flex-flow",
        "flex-flow"
      ],
      "contractCaseIds": [
        "grammar.flex-flow.direction",
        "grammar.flex-flow.wrap",
        "grammar.flex-flow.both",
        "grammar.flex-flow.balance",
        "grammar.flex-flow.explicit-wrap-balance",
        "grammar.flex-flow.reordered-balance",
        "grammar.flex-flow.reverse-balance",
        "grammar.flex-flow.nowrap-balance-invalid",
        "grammar.flex-flow.duplicate-direction-invalid"
      ]
    },
    {
      "codec": "font",
      "properties": [
        "font"
      ],
      "contractCaseIds": [
        "grammar.font.required",
        "grammar.font.line-height",
        "grammar.font.optional",
        "grammar.font.missing-family-invalid"
      ]
    },
    {
      "codec": "four-side",
      "properties": [
        "border-color",
        "border-style",
        "border-width",
        "inset",
        "margin",
        "padding",
        "scroll-margin",
        "scroll-padding"
      ],
      "contractCaseIds": [
        "grammar.four-side.one",
        "grammar.four-side.two",
        "grammar.four-side.four",
        "grammar.four-side.five-invalid"
      ]
    },
    {
      "codec": "grid",
      "properties": [
        "grid",
        "grid-area",
        "grid-template"
      ],
      "contractCaseIds": [
        "grammar.grid.area",
        "grammar.grid.template",
        "grammar.grid.none",
        "grammar.grid.area-extra-invalid"
      ]
    },
    {
      "codec": "layered",
      "properties": [
        "-webkit-mask",
        "mask"
      ],
      "contractCaseIds": [
        "grammar.layered.none",
        "grammar.layered.image",
        "grammar.layered.position-size",
        "grammar.layered.empty-layer-invalid"
      ]
    },
    {
      "codec": "offset",
      "properties": [
        "offset"
      ],
      "contractCaseIds": [
        "grammar.offset.normal",
        "grammar.offset.path",
        "grammar.offset.distance-rotate",
        "grammar.offset.extra-anchor-invalid"
      ]
    },
    {
      "codec": "overflow",
      "properties": [
        "overflow"
      ],
      "contractCaseIds": [
        "grammar.overflow.one",
        "grammar.overflow.two",
        "grammar.overflow.clip-auto",
        "grammar.overflow.three-invalid"
      ]
    },
    {
      "codec": "repeated-pair",
      "properties": [
        "-webkit-mask-position",
        "animation-range",
        "background-position",
        "border-spacing",
        "contain-intrinsic-size",
        "interest-delay",
        "mask-position",
        "place-content",
        "place-items",
        "place-self",
        "timeline-trigger-activation-range",
        "timeline-trigger-active-range"
      ],
      "contractCaseIds": [
        "grammar.repeated-pair.one",
        "grammar.repeated-pair.two",
        "grammar.repeated-pair.compound",
        "grammar.repeated-pair.extra-invalid"
      ]
    },
    {
      "codec": "scroll-timeline",
      "properties": [
        "scroll-timeline"
      ],
      "contractCaseIds": [
        "grammar.scroll-timeline.name",
        "grammar.scroll-timeline.axis",
        "grammar.scroll-timeline.list",
        "grammar.scroll-timeline.missing-name-invalid"
      ]
    },
    {
      "codec": "slash-pair",
      "properties": [
        "grid-column",
        "grid-row"
      ],
      "contractCaseIds": [
        "grammar.slash-pair.one",
        "grammar.slash-pair.two",
        "grammar.slash-pair.named",
        "grammar.slash-pair.three-invalid"
      ]
    },
    {
      "codec": "text-wrap",
      "properties": [
        "text-wrap"
      ],
      "contractCaseIds": [
        "grammar.text-wrap.mode",
        "grammar.text-wrap.style",
        "grammar.text-wrap.both",
        "grammar.text-wrap.duplicate-mode-invalid"
      ]
    },
    {
      "codec": "transition",
      "properties": [
        "-webkit-transition",
        "transition"
      ],
      "contractCaseIds": [
        "grammar.transition.property-duration",
        "grammar.transition.optional",
        "grammar.transition.list",
        "grammar.transition.three-times-invalid"
      ]
    },
    {
      "codec": "two-value",
      "properties": [
        "gap",
        "grid-gap",
        "inset-block",
        "inset-inline",
        "margin-block",
        "margin-inline",
        "overscroll-behavior",
        "padding-block",
        "padding-inline",
        "scroll-margin-block",
        "scroll-margin-inline",
        "scroll-padding-block",
        "scroll-padding-inline"
      ],
      "contractCaseIds": [
        "grammar.two-value.one",
        "grammar.two-value.two",
        "grammar.two-value.keyword-pair",
        "grammar.two-value.three-invalid"
      ]
    },
    {
      "codec": "typed-object",
      "properties": [
        "-webkit-text-emphasis",
        "-webkit-text-stroke",
        "font-synthesis",
        "list-style",
        "outline",
        "position-try",
        "text-box",
        "text-decoration",
        "text-emphasis",
        "timeline-trigger",
        "view-timeline"
      ],
      "contractCaseIds": [
        "grammar.typed-object.outline",
        "grammar.typed-object.list-style",
        "grammar.typed-object.text-box",
        "grammar.typed-object.outline-duplicate-invalid"
      ]
    },
    {
      "codec": "uniform",
      "properties": [
        "-webkit-columns",
        "border-block-color",
        "border-block-style",
        "border-block-width",
        "border-inline-color",
        "border-inline-style",
        "border-inline-width",
        "column-rule-inset",